No.     Time        Source                Destination           Protocol Length Info
      1 0.000000    192.168.1.164         142.104.5.64          TCP      62     1200→80 [SYN] Seq=0 Win=16384 Len=0 MSS=1460 SACK_PERM=1

Frame 1: 62 bytes on wire (496 bits), 62 bytes captured (496 bits)
Ethernet II, Src: Intel_a1:48:60 (00:0e:35:a1:48:60), Dst: 3com_20:98:c5 (00:10:5a:20:98:c5)
Internet Protocol Version 4, Src: 192.168.1.164 (192.168.1.164), Dst: 142.104.5.64 (142.104.5.64)
Transmission Control Protocol, Src Port: 1200 (1200), Dst Port: 80 (80), Seq: 0, Len: 0

No.     Time        Source                Destination           Protocol Length Info
      2 0.002812    142.104.5.64          192.168.1.164         TCP      60     80→1200 [SYN, ACK] Seq=0 Ack=1 Win=17520 Len=0 MSS=1460

Frame 2: 60 bytes on wire (480 bits), 60 bytes captured (480 bits)
Ethernet II, Src: 3com_20:98:c5 (00:10:5a:20:98:c5), Dst: Intel_a1:48:60 (00:0e:35:a1:48:60)
Internet Protocol Version 4, Src: 142.104.5.64 (142.104.5.64), Dst: 192.168.1.164 (192.168.1.164)
Transmission Control Protocol, Src Port: 80 (80), Dst Port: 1200 (1200), Seq: 0, Ack: 1, Len: 0

No.     Time        Source                Destination           Protocol Length Info
      3 0.002835    192.168.1.164         142.104.5.64          TCP      54     1200→80 [ACK] Seq=1 Ack=1 Win=17520 Len=0

Frame 3: 54 bytes on wire (432 bits), 54 bytes captured (432 bits)
Ethernet II, Src: Intel_a1:48:60 (00:0e:35:a1:48:60), Dst: 3com_20:98:c5 (00:10:5a:20:98:c5)
Internet Protocol Version 4, Src: 192.168.1.164 (192.168.1.164), Dst: 142.104.5.64 (142.104.5.64)
Transmission Control Protocol, Src Port: 1200 (1200), Dst Port: 80 (80), Seq: 1, Ack: 1, Len: 0

No.     Time        Source                Destination           Protocol Length Info
      4 0.002916    192.168.1.164         142.104.5.64          HTTP     473    GET /index.html HTTP/1.1 

Frame 4: 473 bytes on wire (3784 bits), 473 bytes captured (3784 bits)
Ethernet II, Src: Intel_a1:48:60 (00:0e:35:a1:48:60), Dst: 3com_20:98:c5 (00:10:5a:20:98:c5)
Internet Protocol Version 4, Src: 192.168.1.164 (192.168.1.164), Dst: 142.104.5.64 (142.104.5.64)
Transmission Control Protocol, Src Port: 1200 (1200), Dst Port: 80 (80), Seq: 1, Ack: 1, Len: 419
Hypertext Transfer Protocol

No.     Time        Source                Destination           Protocol Length Info
      5 0.015346    142.104.5.64          192.168.1.164         TCP      1514   [TCP segment of a reassembled PDU]

Frame 5: 1514 bytes on wire (12112 bits), 1514 bytes captured (12112 bits)
Ethernet II, Src: 3com_20:98:c5 (00:10:5a:20:98:c5), Dst: Intel_a1:48:60 (00:0e:35:a1:48:60)
Internet Protocol Version 4, Src: 142.104.5.64 (142.104.5.64), Dst: 192.168.1.164 (192.168.1.164)
Transmission Control Protocol, Src Port: 80 (80), Dst Port: 1200 (1200), Seq: 1, Ack: 420, Len: 1460

No.     Time        Source                Destination           Protocol Length Info
      6 0.016755    142.104.5.64          192.168.1.164         TCP      1514   [TCP segment of a reassembled PDU]

Frame 6: 1514 bytes on wire (12112 bits), 1514 bytes captured (12112 bits)
Ethernet II, Src: 3com_20:98:c5 (00:10:5a:20:98:c5), Dst: Intel_a1:48:60 (00:0e:35:a1:48:60)
Internet Protocol Version 4, Src: 142.104.5.64 (142.104.5.64), Dst: 192.168.1.164 (192.168.1.164)
Transmission Control Protocol, Src Port: 80 (80), Dst Port: 1200 (1200), Seq: 1461, Ack: 420, Len: 1460

No.     Time        Source                Destination           Protocol Length Info
      7 0.016776    192.168.1.164         142.104.5.64          TCP      54     1200→80 [ACK] Seq=420 Ack=2921 Win=17520 Len=0

Frame 7: 54 bytes on wire (432 bits), 54 bytes captured (432 bits)
Ethernet II, Src: Intel_a1:48:60 (00:0e:35:a1:48:60), Dst: 3com_20:98:c5 (00:10:5a:20:98:c5)
Internet Protocol Version 4, Src: 192.168.1.164 (192.168.1.164), Dst: 142.104.5.64 (142.104.5.64)
Transmission Control Protocol, Src Port: 1200 (1200), Dst Port: 80 (80), Seq: 420, Ack: 2921, Len: 0

No.     Time        Source                Destination           Protocol Length Info
      8 0.018250    142.104.5.64          192.168.1.164         TCP      1514   [TCP segment of a reassembled PDU]

Frame 8: 1514 bytes on wire (12112 bits), 1514 bytes captured (12112 bits)
Ethernet II, Src: 3com_20:98:c5 (00:10:5a:20:98:c5), Dst: Intel_a1:48:60 (00:0e:35:a1:48:60)
Internet Protocol Version 4, Src: 142.104.5.64 (142.104.5.64), Dst: 192.168.1.164 (192.168.1.164)
Transmission Control Protocol, Src Port: 80 (80), Dst Port: 1200 (1200), Seq: 2921, Ack: 420, Len: 1460

No.     Time        Source                Destination           Protocol Length Info
      9 0.025730    142.104.5.64          192.168.1.164         TCP      1514   [TCP segment of a reassembled PDU]

Frame 9: 1514 bytes on wire (12112 bits), 1514 bytes captured (12112 bits)
Ethernet II, Src: 3com_20:98:c5 (00:10:5a:20:98:c5), Dst: Intel_a1:48:60 (00:0e:35:a1:48:60)
Internet Protocol Version 4, Src: 142.104.5.64 (142.104.5.64), Dst: 192.168.1.164 (192.168.1.164)
Transmission Control Protocol, Src Port: 80 (80), Dst Port: 1200 (1200), Seq: 4381, Ack: 420, Len: 1460

No.     Time        Source                Destination           Protocol Length Info
     10 0.025753    192.168.1.164         142.104.5.64          TCP      54     1200→80 [ACK] Seq=420 Ack=5841 Win=17520 Len=0

Frame 10: 54 bytes on wire (432 bits), 54 bytes captured (432 bits)
Ethernet II, Src: Intel_a1:48:60 (00:0e:35:a1:48:60), Dst: 3com_20:98:c5 (00:10:5a:20:98:c5)
Internet Protocol Version 4, Src: 192.168.1.164 (192.168.1.164), Dst: 142.104.5.64 (142.104.5.64)
Transmission Control Protocol, Src Port: 1200 (1200), Dst Port: 80 (80), Seq: 420, Ack: 5841, Len: 0

No.     Time        Source                Destination           Protocol Length Info
     11 0.027093    142.104.5.64          192.168.1.164         TCP      1514   [TCP segment of a reassembled PDU]

Frame 11: 1514 bytes on wire (12112 bits), 1514 bytes captured (12112 bits)
Ethernet II, Src: 3com_20:98:c5 (00:10:5a:20:98:c5), Dst: Intel_a1:48:60 (00:0e:35:a1:48:60)
Internet Protocol Version 4, Src: 142.104.5.64 (142.104.5.64), Dst: 192.168.1.164 (192.168.1.164)
Transmission Control Protocol, Src Port: 80 (80), Dst Port: 1200 (1200), Seq: 5841, Ack: 420, Len: 1460

No.     Time        Source                Destination           Protocol Length Info
     12 0.030109    142.104.5.64          192.168.1.164         TCP      1514   [TCP segment of a reassembled PDU]

Frame 12: 1514 bytes on wire (12112 bits), 1514 bytes captured (12112 bits)
Ethernet II, Src: 3com_20:98:c5 (00:10:5a:20:98:c5), Dst: Intel_a1:48:60 (00:0e:35:a1:48:60)
Internet Protocol Version 4, Src: 142.104.5.64 (142.104.5.64), Dst: 192.168.1.164 (192.168.1.164)
Transmission Control Protocol, Src Port: 80 (80), Dst Port: 1200 (1200), Seq: 7301, Ack: 420, Len: 1460

No.     Time        Source                Destination           Protocol Length Info
     13 0.030129    192.168.1.164         142.104.5.64          TCP      54     1200→80 [ACK] Seq=420 Ack=8761 Win=17520 Len=0

Frame 13: 54 bytes on wire (432 bits), 54 bytes captured (432 bits)
Ethernet II, Src: Intel_a1:48:60 (00:0e:35:a1:48:60), Dst: 3com_20:98:c5 (00:10:5a:20:98:c5)
Internet Protocol Version 4, Src: 192.168.1.164 (192.168.1.164), Dst: 142.104.5.64 (142.104.5.64)
Transmission Control Protocol, Src Port: 1200 (1200), Dst Port: 80 (80), Seq: 420, Ack: 8761, Len: 0

No.     Time        Source                Destination           Protocol Length Info
     14 0.034411    142.104.5.64          192.168.1.164         TCP      1514   [TCP segment of a reassembled PDU]

Frame 14: 1514 bytes on wire (12112 bits), 1514 bytes captured (12112 bits)
Ethernet II, Src: 3com_20:98:c5 (00:10:5a:20:98:c5), Dst: Intel_a1:48:60 (00:0e:35:a1:48:60)
Internet Protocol Version 4, Src: 142.104.5.64 (142.104.5.64), Dst: 192.168.1.164 (192.168.1.164)
Transmission Control Protocol, Src Port: 80 (80), Dst Port: 1200 (1200), Seq: 8761, Ack: 420, Len: 1460

No.     Time        Source                Destination           Protocol Length Info
     15 0.034432    192.168.1.164         142.104.5.64          TCP      54     1200→80 [ACK] Seq=420 Ack=10221 Win=16060 Len=0

Frame 15: 54 bytes on wire (432 bits), 54 bytes captured (432 bits)
Ethernet II, Src: Intel_a1:48:60 (00:0e:35:a1:48:60), Dst: 3com_20:98:c5 (00:10:5a:20:98:c5)
Internet Protocol Version 4, Src: 192.168.1.164 (192.168.1.164), Dst: 142.104.5.64 (142.104.5.64)
Transmission Control Protocol, Src Port: 1200 (1200), Dst Port: 80 (80), Seq: 420, Ack: 10221, Len: 0

No.     Time        Source                Destination           Protocol Length Info
     16 0.035788    142.104.5.64          192.168.1.164         TCP      1514   [TCP segment of a reassembled PDU]

Frame 16: 1514 bytes on wire (12112 bits), 1514 bytes captured (12112 bits)
Ethernet II, Src: 3com_20:98:c5 (00:10:5a:20:98:c5), Dst: Intel_a1:48:60 (00:0e:35:a1:48:60)
Internet Protocol Version 4, Src: 142.104.5.64 (142.104.5.64), Dst: 192.168.1.164 (192.168.1.164)
Transmission Control Protocol, Src Port: 80 (80), Dst Port: 1200 (1200), Seq: 10221, Ack: 420, Len: 1460

No.     Time        Source                Destination           Protocol Length Info
     17 0.037570    142.104.5.64          192.168.1.164         TCP      1514   [TCP segment of a reassembled PDU]

Frame 17: 1514 bytes on wire (12112 bits), 1514 bytes captured (12112 bits)
Ethernet II, Src: 3com_20:98:c5 (00:10:5a:20:98:c5), Dst: Intel_a1:48:60 (00:0e:35:a1:48:60)
Internet Protocol Version 4, Src: 142.104.5.64 (142.104.5.64), Dst: 192.168.1.164 (192.168.1.164)
Transmission Control Protocol, Src Port: 80 (80), Dst Port: 1200 (1200), Seq: 11681, Ack: 420, Len: 1460

No.     Time        Source                Destination           Protocol Length Info
     18 0.037583    192.168.1.164         142.104.5.64          TCP      54     1200→80 [ACK] Seq=420 Ack=13141 Win=13140 Len=0

Frame 18: 54 bytes on wire (432 bits), 54 bytes captured (432 bits)
Ethernet II, Src: Intel_a1:48:60 (00:0e:35:a1:48:60), Dst: 3com_20:98:c5 (00:10:5a:20:98:c5)
Internet Protocol Version 4, Src: 192.168.1.164 (192.168.1.164), Dst: 142.104.5.64 (142.104.5.64)
Transmission Control Protocol, Src Port: 1200 (1200), Dst Port: 80 (80), Seq: 420, Ack: 13141, Len: 0

No.     Time        Source                Destination           Protocol Length Info
     19 0.039063    142.104.5.64          192.168.1.164         TCP      1514   [TCP segment of a reassembled PDU]

Frame 19: 1514 bytes on wire (12112 bits), 1514 bytes captured (12112 bits)
Ethernet II, Src: 3com_20:98:c5 (00:10:5a:20:98:c5), Dst: Intel_a1:48:60 (00:0e:35:a1:48:60)
Internet Protocol Version 4, Src: 142.104.5.64 (142.104.5.64), Dst: 192.168.1.164 (192.168.1.164)
Transmission Control Protocol, Src Port: 80 (80), Dst Port: 1200 (1200), Seq: 13141, Ack: 420, Len: 1460

No.     Time        Source                Destination           Protocol Length Info
     20 0.040795    142.104.5.64          192.168.1.164         HTTP     1426   HTTP/1.1 200 OK  (text/html)

Frame 20: 1426 bytes on wire (11408 bits), 1426 bytes captured (11408 bits)
Ethernet II, Src: 3com_20:98:c5 (00:10:5a:20:98:c5), Dst: Intel_a1:48:60 (00:0e:35:a1:48:60)
Internet Protocol Version 4, Src: 142.104.5.64 (142.104.5.64), Dst: 192.168.1.164 (192.168.1.164)
Transmission Control Protocol, Src Port: 80 (80), Dst Port: 1200 (1200), Seq: 14601, Ack: 420, Len: 1372
[11 Reassembled TCP Segments (15972 bytes): #5(1460), #6(1460), #8(1460), #9(1460), #11(1460), #12(1460), #14(1460), #16(1460), #17(1460), #19(1460), #20(1372)]
Hypertext Transfer Protocol
Line-based text data: text/html

No.     Time        Source                Destination           Protocol Length Info
     21 0.040811    192.168.1.164         142.104.5.64          TCP      54     1200→80 [ACK] Seq=420 Ack=15973 Win=10308 Len=0

Frame 21: 54 bytes on wire (432 bits), 54 bytes captured (432 bits)
Ethernet II, Src: Intel_a1:48:60 (00:0e:35:a1:48:60), Dst: 3com_20:98:c5 (00:10:5a:20:98:c5)
Internet Protocol Version 4, Src: 192.168.1.164 (192.168.1.164), Dst: 142.104.5.64 (142.104.5.64)
Transmission Control Protocol, Src Port: 1200 (1200), Dst Port: 80 (80), Seq: 420, Ack: 15973, Len: 0

No.     Time        Source                Destination           Protocol Length Info
     22 0.291372    192.168.1.164         142.104.5.64          TCP      54     [TCP Window Update] 1200→80 [ACK] Seq=420 Ack=15973 Win=17520 Len=0

Frame 22: 54 bytes on wire (432 bits), 54 bytes captured (432 bits)
Ethernet II, Src: Intel_a1:48:60 (00:0e:35:a1:48:60), Dst: 3com_20:98:c5 (00:10:5a:20:98:c5)
Internet Protocol Version 4, Src: 192.168.1.164 (192.168.1.164), Dst: 142.104.5.64 (142.104.5.64)
Transmission Control Protocol, Src Port: 1200 (1200), Dst Port: 80 (80), Seq: 420, Ack: 15973, Len: 0

No.     Time        Source                Destination           Protocol Length Info
     23 2.607847    192.168.1.164         142.104.5.64          HTTP     491    GET /about/welcome.html HTTP/1.1 

Frame 23: 491 bytes on wire (3928 bits), 491 bytes captured (3928 bits)
Ethernet II, Src: Intel_a1:48:60 (00:0e:35:a1:48:60), Dst: 3com_20:98:c5 (00:10:5a:20:98:c5)
Internet Protocol Version 4, Src: 192.168.1.164 (192.168.1.164), Dst: 142.104.5.64 (142.104.5.64)
Transmission Control Protocol, Src Port: 1200 (1200), Dst Port: 80 (80), Seq: 420, Ack: 15973, Len: 437
Hypertext Transfer Protocol

No.     Time        Source                Destination           Protocol Length Info
     24 2.632146    142.104.5.64          192.168.1.164         TCP      1514   [TCP segment of a reassembled PDU]

Frame 24: 1514 bytes on wire (12112 bits), 1514 bytes captured (12112 bits)
Ethernet II, Src: 3com_20:98:c5 (00:10:5a:20:98:c5), Dst: Intel_a1:48:60 (00:0e:35:a1:48:60)
Internet Protocol Version 4, Src: 142.104.5.64 (142.104.5.64), Dst: 192.168.1.164 (192.168.1.164)
Transmission Control Protocol, Src Port: 80 (80), Dst Port: 1200 (1200), Seq: 15973, Ack: 857, Len: 1460

No.     Time        Source                Destination           Protocol Length Info
     25 2.633580    142.104.5.64          192.168.1.164         TCP      1514   [TCP segment of a reassembled PDU]

Frame 25: 1514 bytes on wire (12112 bits), 1514 bytes captured (12112 bits)
Ethernet II, Src: 3com_20:98:c5 (00:10:5a:20:98:c5), Dst: Intel_a1:48:60 (00:0e:35:a1:48:60)
Internet Protocol Version 4, Src: 142.104.5.64 (142.104.5.64), Dst: 192.168.1.164 (192.168.1.164)
Transmission Control Protocol, Src Port: 80 (80), Dst Port: 1200 (1200), Seq: 17433, Ack: 857, Len: 1460

No.     Time        Source                Destination           Protocol Length Info
     26 2.633599    192.168.1.164         142.104.5.64          TCP      54     1200→80 [ACK] Seq=857 Ack=18893 Win=17520 Len=0

Frame 26: 54 bytes on wire (432 bits), 54 bytes captured (432 bits)
Ethernet II, Src: Intel_a1:48:60 (00:0e:35:a1:48:60), Dst: 3com_20:98:c5 (00:10:5a:20:98:c5)
Internet Protocol Version 4, Src: 192.168.1.164 (192.168.1.164), Dst: 142.104.5.64 (142.104.5.64)
Transmission Control Protocol, Src Port: 1200 (1200), Dst Port: 80 (80), Seq: 857, Ack: 18893, Len: 0

No.     Time        Source                Destination           Protocol Length Info
     27 2.635054    142.104.5.64          192.168.1.164         TCP      1514   [TCP segment of a reassembled PDU]

Frame 27: 1514 bytes on wire (12112 bits), 1514 bytes captured (12112 bits)
Ethernet II, Src: 3com_20:98:c5 (00:10:5a:20:98:c5), Dst: Intel_a1:48:60 (00:0e:35:a1:48:60)
Internet Protocol Version 4, Src: 142.104.5.64 (142.104.5.64), Dst: 192.168.1.164 (192.168.1.164)
Transmission Control Protocol, Src Port: 80 (80), Dst Port: 1200 (1200), Seq: 18893, Ack: 857, Len: 1460

No.     Time        Source                Destination           Protocol Length Info
     28 2.636436    142.104.5.64          192.168.1.164         TCP      1514   [TCP segment of a reassembled PDU]

Frame 28: 1514 bytes on wire (12112 bits), 1514 bytes captured (12112 bits)
Ethernet II, Src: 3com_20:98:c5 (00:10:5a:20:98:c5), Dst: Intel_a1:48:60 (00:0e:35:a1:48:60)
Internet Protocol Version 4, Src: 142.104.5.64 (142.104.5.64), Dst: 192.168.1.164 (192.168.1.164)
Transmission Control Protocol, Src Port: 80 (80), Dst Port: 1200 (1200), Seq: 20353, Ack: 857, Len: 1460

No.     Time        Source                Destination           Protocol Length Info
     29 2.636450    192.168.1.164         142.104.5.64          TCP      54     1200→80 [ACK] Seq=857 Ack=21813 Win=17520 Len=0

Frame 29: 54 bytes on wire (432 bits), 54 bytes captured (432 bits)
Ethernet II, Src: Intel_a1:48:60 (00:0e:35:a1:48:60), Dst: 3com_20:98:c5 (00:10:5a:20:98:c5)
Internet Protocol Version 4, Src: 192.168.1.164 (192.168.1.164), Dst: 142.104.5.64 (142.104.5.64)
Transmission Control Protocol, Src Port: 1200 (1200), Dst Port: 80 (80), Seq: 857, Ack: 21813, Len: 0

No.     Time        Source                Destination           Protocol Length Info
     30 2.638154    142.104.5.64          192.168.1.164         TCP      1514   [TCP segment of a reassembled PDU]

Frame 30: 1514 bytes on wire (12112 bits), 1514 bytes captured (12112 bits)
Ethernet II, Src: 3com_20:98:c5 (00:10:5a:20:98:c5), Dst: Intel_a1:48:60 (00:0e:35:a1:48:60)
Internet Protocol Version 4, Src: 142.104.5.64 (142.104.5.64), Dst: 192.168.1.164 (192.168.1.164)
Transmission Control Protocol, Src Port: 80 (80), Dst Port: 1200 (1200), Seq: 21813, Ack: 857, Len: 1460

No.     Time        Source                Destination           Protocol Length Info
     31 2.639974    142.104.5.64          192.168.1.164         TCP      1514   [TCP segment of a reassembled PDU]

Frame 31: 1514 bytes on wire (12112 bits), 1514 bytes captured (12112 bits)
Ethernet II, Src: 3com_20:98:c5 (00:10:5a:20:98:c5), Dst: Intel_a1:48:60 (00:0e:35:a1:48:60)
Internet Protocol Version 4, Src: 142.104.5.64 (142.104.5.64), Dst: 192.168.1.164 (192.168.1.164)
Transmission Control Protocol, Src Port: 80 (80), Dst Port: 1200 (1200), Seq: 23273, Ack: 857, Len: 1460

No.     Time        Source                Destination           Protocol Length Info
     32 2.639988    192.168.1.164         142.104.5.64          TCP      54     1200→80 [ACK] Seq=857 Ack=24733 Win=17520 Len=0

Frame 32: 54 bytes on wire (432 bits), 54 bytes captured (432 bits)
Ethernet II, Src: Intel_a1:48:60 (00:0e:35:a1:48:60), Dst: 3com_20:98:c5 (00:10:5a:20:98:c5)
Internet Protocol Version 4, Src: 192.168.1.164 (192.168.1.164), Dst: 142.104.5.64 (142.104.5.64)
Transmission Control Protocol, Src Port: 1200 (1200), Dst Port: 80 (80), Seq: 857, Ack: 24733, Len: 0

No.     Time        Source                Destination           Protocol Length Info
     33 2.641453    142.104.5.64          192.168.1.164         TCP      1514   [TCP segment of a reassembled PDU]

Frame 33: 1514 bytes on wire (12112 bits), 1514 bytes captured (12112 bits)
Ethernet II, Src: 3com_20:98:c5 (00:10:5a:20:98:c5), Dst: Intel_a1:48:60 (00:0e:35:a1:48:60)
Internet Protocol Version 4, Src: 142.104.5.64 (142.104.5.64), Dst: 192.168.1.164 (192.168.1.164)
Transmission Control Protocol, Src Port: 80 (80), Dst Port: 1200 (1200), Seq: 24733, Ack: 857, Len: 1460

No.     Time        Source                Destination           Protocol Length Info
     34 2.641471    192.168.1.164         142.104.5.64          TCP      54     1200→80 [ACK] Seq=857 Ack=26193 Win=16060 Len=0

Frame 34: 54 bytes on wire (432 bits), 54 bytes captured (432 bits)
Ethernet II, Src: Intel_a1:48:60 (00:0e:35:a1:48:60), Dst: 3com_20:98:c5 (00:10:5a:20:98:c5)
Internet Protocol Version 4, Src: 192.168.1.164 (192.168.1.164), Dst: 142.104.5.64 (142.104.5.64)
Transmission Control Protocol, Src Port: 1200 (1200), Dst Port: 80 (80), Seq: 857, Ack: 26193, Len: 0

No.     Time        Source                Destination           Protocol Length Info
     35 2.643176    142.104.5.64          192.168.1.164         TCP      1514   [TCP segment of a reassembled PDU]

Frame 35: 1514 bytes on wire (12112 bits), 1514 bytes captured (12112 bits)
Ethernet II, Src: 3com_20:98:c5 (00:10:5a:20:98:c5), Dst: Intel_a1:48:60 (00:0e:35:a1:48:60)
Internet Protocol Version 4, Src: 142.104.5.64 (142.104.5.64), Dst: 192.168.1.164 (192.168.1.164)
Transmission Control Protocol, Src Port: 80 (80), Dst Port: 1200 (1200), Seq: 26193, Ack: 857, Len: 1460

No.     Time        Source                Destination           Protocol Length Info
     36 2.644653    142.104.5.64          192.168.1.164         TCP      1514   [TCP segment of a reassembled PDU]

Frame 36: 1514 bytes on wire (12112 bits), 1514 bytes captured (12112 bits)
Ethernet II, Src: 3com_20:98:c5 (00:10:5a:20:98:c5), Dst: Intel_a1:48:60 (00:0e:35:a1:48:60)
Internet Protocol Version 4, Src: 142.104.5.64 (142.104.5.64), Dst: 192.168.1.164 (192.168.1.164)
Transmission Control Protocol, Src Port: 80 (80), Dst Port: 1200 (1200), Seq: 27653, Ack: 857, Len: 1460

No.     Time        Source                Destination           Protocol Length Info
     37 2.644666    192.168.1.164         142.104.5.64          TCP      54     1200→80 [ACK] Seq=857 Ack=29113 Win=13140 Len=0

Frame 37: 54 bytes on wire (432 bits), 54 bytes captured (432 bits)
Ethernet II, Src: Intel_a1:48:60 (00:0e:35:a1:48:60), Dst: 3com_20:98:c5 (00:10:5a:20:98:c5)
Internet Protocol Version 4, Src: 192.168.1.164 (192.168.1.164), Dst: 142.104.5.64 (142.104.5.64)
Transmission Control Protocol, Src Port: 1200 (1200), Dst Port: 80 (80), Seq: 857, Ack: 29113, Len: 0

No.     Time        Source                Destination           Protocol Length Info
     38 2.653198    192.168.1.164         142.104.5.64          TCP      54     [TCP Window Update] 1200→80 [ACK] Seq=857 Ack=29113 Win=17520 Len=0

Frame 38: 54 bytes on wire (432 bits), 54 bytes captured (432 bits)
Ethernet II, Src: Intel_a1:48:60 (00:0e:35:a1:48:60), Dst: 3com_20:98:c5 (00:10:5a:20:98:c5)
Internet Protocol Version 4, Src: 192.168.1.164 (192.168.1.164), Dst: 142.104.5.64 (142.104.5.64)
Transmission Control Protocol, Src Port: 1200 (1200), Dst Port: 80 (80), Seq: 857, Ack: 29113, Len: 0

No.     Time        Source                Destination           Protocol Length Info
     39 2.654450    142.104.5.64          192.168.1.164         TCP      1514   [TCP segment of a reassembled PDU]

Frame 39: 1514 bytes on wire (12112 bits), 1514 bytes captured (12112 bits)
Ethernet II, Src: 3com_20:98:c5 (00:10:5a:20:98:c5), Dst: Intel_a1:48:60 (00:0e:35:a1:48:60)
Internet Protocol Version 4, Src: 142.104.5.64 (142.104.5.64), Dst: 192.168.1.164 (192.168.1.164)
Transmission Control Protocol, Src Port: 80 (80), Dst Port: 1200 (1200), Seq: 29113, Ack: 857, Len: 1460

No.     Time        Source                Destination           Protocol Length Info
     40 2.658101    142.104.5.64          192.168.1.164         TCP      1514   [TCP segment of a reassembled PDU]

Frame 40: 1514 bytes on wire (12112 bits), 1514 bytes captured (12112 bits)
Ethernet II, Src: 3com_20:98:c5 (00:10:5a:20:98:c5), Dst: Intel_a1:48:60 (00:0e:35:a1:48:60)
Internet Protocol Version 4, Src: 142.104.5.64 (142.104.5.64), Dst: 192.168.1.164 (192.168.1.164)
Transmission Control Protocol, Src Port: 80 (80), Dst Port: 1200 (1200), Seq: 30573, Ack: 857, Len: 1460

No.     Time        Source                Destination           Protocol Length Info
     41 2.658127    192.168.1.164         142.104.5.64          TCP      54     1200→80 [ACK] Seq=857 Ack=32033 Win=17520 Len=0

Frame 41: 54 bytes on wire (432 bits), 54 bytes captured (432 bits)
Ethernet II, Src: Intel_a1:48:60 (00:0e:35:a1:48:60), Dst: 3com_20:98:c5 (00:10:5a:20:98:c5)
Internet Protocol Version 4, Src: 192.168.1.164 (192.168.1.164), Dst: 142.104.5.64 (142.104.5.64)
Transmission Control Protocol, Src Port: 1200 (1200), Dst Port: 80 (80), Seq: 857, Ack: 32033, Len: 0

No.     Time        Source                Destination           Protocol Length Info
     42 2.659628    142.104.5.64          192.168.1.164         HTTP     544    HTTP/1.1 200 OK  (text/html)

Frame 42: 544 bytes on wire (4352 bits), 544 bytes captured (4352 bits)
Ethernet II, Src: 3com_20:98:c5 (00:10:5a:20:98:c5), Dst: Intel_a1:48:60 (00:0e:35:a1:48:60)
Internet Protocol Version 4, Src: 142.104.5.64 (142.104.5.64), Dst: 192.168.1.164 (192.168.1.164)
Transmission Control Protocol, Src Port: 80 (80), Dst Port: 1200 (1200), Seq: 32033, Ack: 857, Len: 490
[12 Reassembled TCP Segments (16550 bytes): #24(1460), #25(1460), #27(1460), #28(1460), #30(1460), #31(1460), #33(1460), #35(1460), #36(1460), #39(1460), #40(1460), #42(490)]
Hypertext Transfer Protocol
Line-based text data: text/html

No.     Time        Source                Destination           Protocol Length Info
     43 2.669554    192.168.1.164         142.104.5.64          TCP      62     1201→80 [SYN] Seq=0 Win=16384 Len=0 MSS=1460 SACK_PERM=1

Frame 43: 62 bytes on wire (496 bits), 62 bytes captured (496 bits)
Ethernet II, Src: Intel_a1:48:60 (00:0e:35:a1:48:60), Dst: 3com_20:98:c5 (00:10:5a:20:98:c5)
Internet Protocol Version 4, Src: 192.168.1.164 (192.168.1.164), Dst: 142.104.5.64 (142.104.5.64)
Transmission Control Protocol, Src Port: 1201 (1201), Dst Port: 80 (80), Seq: 0, Len: 0

No.     Time        Source                Destination           Protocol Length Info
     44 2.682610    142.104.5.64          192.168.1.164         TCP      60     80→1201 [SYN, ACK] Seq=0 Ack=1 Win=17520 Len=0 MSS=1460

Frame 44: 60 bytes on wire (480 bits), 60 bytes captured (480 bits)
Ethernet II, Src: 3com_20:98:c5 (00:10:5a:20:98:c5), Dst: Intel_a1:48:60 (00:0e:35:a1:48:60)
Internet Protocol Version 4, Src: 142.104.5.64 (142.104.5.64), Dst: 192.168.1.164 (192.168.1.164)
Transmission Control Protocol, Src Port: 80 (80), Dst Port: 1201 (1201), Seq: 0, Ack: 1, Len: 0

No.     Time        Source                Destination           Protocol Length Info
     45 2.682672    192.168.1.164         142.104.5.64          TCP      54     1201→80 [ACK] Seq=1 Ack=1 Win=17520 Len=0

Frame 45: 54 bytes on wire (432 bits), 54 bytes captured (432 bits)
Ethernet II, Src: Intel_a1:48:60 (00:0e:35:a1:48:60), Dst: 3com_20:98:c5 (00:10:5a:20:98:c5)
Internet Protocol Version 4, Src: 192.168.1.164 (192.168.1.164), Dst: 142.104.5.64 (142.104.5.64)
Transmission Control Protocol, Src Port: 1201 (1201), Dst Port: 80 (80), Seq: 1, Ack: 1, Len: 0

No.     Time        Source                Destination           Protocol Length Info
     46 2.682800    192.168.1.164         142.104.5.64          HTTP     347    GET /assets/photos/president.jpg HTTP/1.1 

Frame 46: 347 bytes on wire (2776 bits), 347 bytes captured (2776 bits)
Ethernet II, Src: Intel_a1:48:60 (00:0e:35:a1:48:60), Dst: 3com_20:98:c5 (00:10:5a:20:98:c5)
Internet Protocol Version 4, Src: 192.168.1.164 (192.168.1.164), Dst: 142.104.5.64 (142.104.5.64)
Transmission Control Protocol, Src Port: 1201 (1201), Dst Port: 80 (80), Seq: 1, Ack: 1, Len: 293
Hypertext Transfer Protocol

No.     Time        Source                Destination           Protocol Length Info
     47 2.695080    142.104.5.64          192.168.1.164         TCP      1514   [TCP segment of a reassembled PDU]

Frame 47: 1514 bytes on wire (12112 bits), 1514 bytes captured (12112 bits)
Ethernet II, Src: 3com_20:98:c5 (00:10:5a:20:98:c5), Dst: Intel_a1:48:60 (00:0e:35:a1:48:60)
Internet Protocol Version 4, Src: 142.104.5.64 (142.104.5.64), Dst: 192.168.1.164 (192.168.1.164)
Transmission Control Protocol, Src Port: 80 (80), Dst Port: 1201 (1201), Seq: 1, Ack: 294, Len: 1460

No.     Time        Source                Destination           Protocol Length Info
     48 2.696407    142.104.5.64          192.168.1.164         TCP      1514   [TCP segment of a reassembled PDU]

Frame 48: 1514 bytes on wire (12112 bits), 1514 bytes captured (12112 bits)
Ethernet II, Src: 3com_20:98:c5 (00:10:5a:20:98:c5), Dst: Intel_a1:48:60 (00:0e:35:a1:48:60)
Internet Protocol Version 4, Src: 142.104.5.64 (142.104.5.64), Dst: 192.168.1.164 (192.168.1.164)
Transmission Control Protocol, Src Port: 80 (80), Dst Port: 1201 (1201), Seq: 1461, Ack: 294, Len: 1460

No.     Time        Source                Destination           Protocol Length Info
     49 2.696432    192.168.1.164         142.104.5.64          TCP      54     1201→80 [ACK] Seq=294 Ack=2921 Win=17520 Len=0

Frame 49: 54 bytes on wire (432 bits), 54 bytes captured (432 bits)
Ethernet II, Src: Intel_a1:48:60 (00:0e:35:a1:48:60), Dst: 3com_20:98:c5 (00:10:5a:20:98:c5)
Internet Protocol Version 4, Src: 192.168.1.164 (192.168.1.164), Dst: 142.104.5.64 (142.104.5.64)
Transmission Control Protocol, Src Port: 1201 (1201), Dst Port: 80 (80), Seq: 294, Ack: 2921, Len: 0

No.     Time        Source                Destination           Protocol Length Info
     50 2.697782    142.104.5.64          192.168.1.164         TCP      1514   [TCP segment of a reassembled PDU]

Frame 50: 1514 bytes on wire (12112 bits), 1514 bytes captured (12112 bits)
Ethernet II, Src: 3com_20:98:c5 (00:10:5a:20:98:c5), Dst: Intel_a1:48:60 (00:0e:35:a1:48:60)
Internet Protocol Version 4, Src: 142.104.5.64 (142.104.5.64), Dst: 192.168.1.164 (192.168.1.164)
Transmission Control Protocol, Src Port: 80 (80), Dst Port: 1201 (1201), Seq: 2921, Ack: 294, Len: 1460

No.     Time        Source                Destination           Protocol Length Info
     51 2.705228    142.104.5.64          192.168.1.164         TCP      1514   [TCP segment of a reassembled PDU]

Frame 51: 1514 bytes on wire (12112 bits), 1514 bytes captured (12112 bits)
Ethernet II, Src: 3com_20:98:c5 (00:10:5a:20:98:c5), Dst: Intel_a1:48:60 (00:0e:35:a1:48:60)
Internet Protocol Version 4, Src: 142.104.5.64 (142.104.5.64), Dst: 192.168.1.164 (192.168.1.164)
Transmission Control Protocol, Src Port: 80 (80), Dst Port: 1201 (1201), Seq: 4381, Ack: 294, Len: 1460

No.     Time        Source                Destination           Protocol Length Info
     52 2.705273    192.168.1.164         142.104.5.64          TCP      54     1201→80 [ACK] Seq=294 Ack=5841 Win=17520 Len=0

Frame 52: 54 bytes on wire (432 bits), 54 bytes captured (432 bits)
Ethernet II, Src: Intel_a1:48:60 (00:0e:35:a1:48:60), Dst: 3com_20:98:c5 (00:10:5a:20:98:c5)
Internet Protocol Version 4, Src: 192.168.1.164 (192.168.1.164), Dst: 142.104.5.64 (142.104.5.64)
Transmission Control Protocol, Src Port: 1201 (1201), Dst Port: 80 (80), Seq: 294, Ack: 5841, Len: 0

No.     Time        Source                Destination           Protocol Length Info
     53 2.706019    192.168.1.164         142.104.5.64          HTTP     340    GET /assets/images/up.gif HTTP/1.1 

Frame 53: 340 bytes on wire (2720 bits), 340 bytes captured (2720 bits)
Ethernet II, Src: Intel_a1:48:60 (00:0e:35:a1:48:60), Dst: 3com_20:98:c5 (00:10:5a:20:98:c5)
Internet Protocol Version 4, Src: 192.168.1.164 (192.168.1.164), Dst: 142.104.5.64 (142.104.5.64)
Transmission Control Protocol, Src Port: 1200 (1200), Dst Port: 80 (80), Seq: 857, Ack: 32523, Len: 286
Hypertext Transfer Protocol

No.     Time        Source                Destination           Protocol Length Info
     54 2.706712    142.104.5.64          192.168.1.164         TCP      1514   [TCP segment of a reassembled PDU]

Frame 54: 1514 bytes on wire (12112 bits), 1514 bytes captured (12112 bits)
Ethernet II, Src: 3com_20:98:c5 (00:10:5a:20:98:c5), Dst: Intel_a1:48:60 (00:0e:35:a1:48:60)
Internet Protocol Version 4, Src: 142.104.5.64 (142.104.5.64), Dst: 192.168.1.164 (192.168.1.164)
Transmission Control Protocol, Src Port: 80 (80), Dst Port: 1201 (1201), Seq: 5841, Ack: 294, Len: 1460

No.     Time        Source                Destination           Protocol Length Info
     55 2.708483    142.104.5.64          192.168.1.164         TCP      1514   [TCP segment of a reassembled PDU]

Frame 55: 1514 bytes on wire (12112 bits), 1514 bytes captured (12112 bits)
Ethernet II, Src: 3com_20:98:c5 (00:10:5a:20:98:c5), Dst: Intel_a1:48:60 (00:0e:35:a1:48:60)
Internet Protocol Version 4, Src: 142.104.5.64 (142.104.5.64), Dst: 192.168.1.164 (192.168.1.164)
Transmission Control Protocol, Src Port: 80 (80), Dst Port: 1201 (1201), Seq: 7301, Ack: 294, Len: 1460

No.     Time        Source                Destination           Protocol Length Info
     56 2.708504    192.168.1.164         142.104.5.64          TCP      54     1201→80 [ACK] Seq=294 Ack=8761 Win=17520 Len=0

Frame 56: 54 bytes on wire (432 bits), 54 bytes captured (432 bits)
Ethernet II, Src: Intel_a1:48:60 (00:0e:35:a1:48:60), Dst: 3com_20:98:c5 (00:10:5a:20:98:c5)
Internet Protocol Version 4, Src: 192.168.1.164 (192.168.1.164), Dst: 142.104.5.64 (142.104.5.64)
Transmission Control Protocol, Src Port: 1201 (1201), Dst Port: 80 (80), Seq: 294, Ack: 8761, Len: 0

No.     Time        Source                Destination           Protocol Length Info
     57 2.714155    142.104.5.64          192.168.1.164         TCP      1514   [TCP segment of a reassembled PDU]

Frame 57: 1514 bytes on wire (12112 bits), 1514 bytes captured (12112 bits)
Ethernet II, Src: 3com_20:98:c5 (00:10:5a:20:98:c5), Dst: Intel_a1:48:60 (00:0e:35:a1:48:60)
Internet Protocol Version 4, Src: 142.104.5.64 (142.104.5.64), Dst: 192.168.1.164 (192.168.1.164)
Transmission Control Protocol, Src Port: 80 (80), Dst Port: 1201 (1201), Seq: 8761, Ack: 294, Len: 1460

No.     Time        Source                Destination           Protocol Length Info
     58 2.715583    142.104.5.64          192.168.1.164         TCP      1514   [TCP segment of a reassembled PDU]

Frame 58: 1514 bytes on wire (12112 bits), 1514 bytes captured (12112 bits)
Ethernet II, Src: 3com_20:98:c5 (00:10:5a:20:98:c5), Dst: Intel_a1:48:60 (00:0e:35:a1:48:60)
Internet Protocol Version 4, Src: 142.104.5.64 (142.104.5.64), Dst: 192.168.1.164 (192.168.1.164)
Transmission Control Protocol, Src Port: 80 (80), Dst Port: 1201 (1201), Seq: 10221, Ack: 294, Len: 1460

No.     Time        Source                Destination           Protocol Length Info
     59 2.715607    192.168.1.164         142.104.5.64          TCP      54     1201→80 [ACK] Seq=294 Ack=11681 Win=17520 Len=0

Frame 59: 54 bytes on wire (432 bits), 54 bytes captured (432 bits)
Ethernet II, Src: Intel_a1:48:60 (00:0e:35:a1:48:60), Dst: 3com_20:98:c5 (00:10:5a:20:98:c5)
Internet Protocol Version 4, Src: 192.168.1.164 (192.168.1.164), Dst: 142.104.5.64 (142.104.5.64)
Transmission Control Protocol, Src Port: 1201 (1201), Dst Port: 80 (80), Seq: 294, Ack: 11681, Len: 0

No.     Time        Source                Destination           Protocol Length Info
     60 2.717024    142.104.5.64          192.168.1.164         TCP      1514   [TCP segment of a reassembled PDU]

Frame 60: 1514 bytes on wire (12112 bits), 1514 bytes captured (12112 bits)
Ethernet II, Src: 3com_20:98:c5 (00:10:5a:20:98:c5), Dst: Intel_a1:48:60 (00:0e:35:a1:48:60)
Internet Protocol Version 4, Src: 142.104.5.64 (142.104.5.64), Dst: 192.168.1.164 (192.168.1.164)
Transmission Control Protocol, Src Port: 80 (80), Dst Port: 1201 (1201), Seq: 11681, Ack: 294, Len: 1460

No.     Time        Source                Destination           Protocol Length Info
     61 2.719236    142.104.5.64          192.168.1.164         TCP      1514   [TCP segment of a reassembled PDU]

Frame 61: 1514 bytes on wire (12112 bits), 1514 bytes captured (12112 bits)
Ethernet II, Src: 3com_20:98:c5 (00:10:5a:20:98:c5), Dst: Intel_a1:48:60 (00:0e:35:a1:48:60)
Internet Protocol Version 4, Src: 142.104.5.64 (142.104.5.64), Dst: 192.168.1.164 (192.168.1.164)
Transmission Control Protocol, Src Port: 80 (80), Dst Port: 1201 (1201), Seq: 13141, Ack: 294, Len: 1460

No.     Time        Source                Destination           Protocol Length Info
     62 2.719262    192.168.1.164         142.104.5.64          TCP      54     1201→80 [ACK] Seq=294 Ack=14601 Win=17520 Len=0

Frame 62: 54 bytes on wire (432 bits), 54 bytes captured (432 bits)
Ethernet II, Src: Intel_a1:48:60 (00:0e:35:a1:48:60), Dst: 3com_20:98:c5 (00:10:5a:20:98:c5)
Internet Protocol Version 4, Src: 192.168.1.164 (192.168.1.164), Dst: 142.104.5.64 (142.104.5.64)
Transmission Control Protocol, Src Port: 1201 (1201), Dst Port: 80 (80), Seq: 294, Ack: 14601, Len: 0

No.     Time        Source                Destination           Protocol Length Info
     63 2.720672    142.104.5.64          192.168.1.164         TCP      1514   [TCP segment of a reassembled PDU]

Frame 63: 1514 bytes on wire (12112 bits), 1514 bytes captured (12112 bits)
Ethernet II, Src: 3com_20:98:c5 (00:10:5a:20:98:c5), Dst: Intel_a1:48:60 (00:0e:35:a1:48:60)
Internet Protocol Version 4, Src: 142.104.5.64 (142.104.5.64), Dst: 192.168.1.164 (192.168.1.164)
Transmission Control Protocol, Src Port: 80 (80), Dst Port: 1201 (1201), Seq: 14601, Ack: 294, Len: 1460

No.     Time        Source                Destination           Protocol Length Info
     64 2.722483    142.104.5.64          192.168.1.164         TCP      1514   [TCP segment of a reassembled PDU]

Frame 64: 1514 bytes on wire (12112 bits), 1514 bytes captured (12112 bits)
Ethernet II, Src: 3com_20:98:c5 (00:10:5a:20:98:c5), Dst: Intel_a1:48:60 (00:0e:35:a1:48:60)
Internet Protocol Version 4, Src: 142.104.5.64 (142.104.5.64), Dst: 192.168.1.164 (192.168.1.164)
Transmission Control Protocol, Src Port: 80 (80), Dst Port: 1201 (1201), Seq: 16061, Ack: 294, Len: 1460

No.     Time        Source                Destination           Protocol Length Info
     65 2.722567    192.168.1.164         142.104.5.64          TCP      54     1201→80 [ACK] Seq=294 Ack=17521 Win=17520 Len=0

Frame 65: 54 bytes on wire (432 bits), 54 bytes captured (432 bits)
Ethernet II, Src: Intel_a1:48:60 (00:0e:35:a1:48:60), Dst: 3com_20:98:c5 (00:10:5a:20:98:c5)
Internet Protocol Version 4, Src: 192.168.1.164 (192.168.1.164), Dst: 142.104.5.64 (142.104.5.64)
Transmission Control Protocol, Src Port: 1201 (1201), Dst Port: 80 (80), Seq: 294, Ack: 17521, Len: 0

No.     Time        Source                Destination           Protocol Length Info
     66 2.723123    142.104.5.64          192.168.1.164         HTTP     453    HTTP/1.1 200 OK  (GIF89a)

Frame 66: 453 bytes on wire (3624 bits), 453 bytes captured (3624 bits)
Ethernet II, Src: 3com_20:98:c5 (00:10:5a:20:98:c5), Dst: Intel_a1:48:60 (00:0e:35:a1:48:60)
Internet Protocol Version 4, Src: 142.104.5.64 (142.104.5.64), Dst: 192.168.1.164 (192.168.1.164)
Transmission Control Protocol, Src Port: 80 (80), Dst Port: 1200 (1200), Seq: 32523, Ack: 1143, Len: 399
Hypertext Transfer Protocol
Compuserve GIF, Version: GIF89a

No.     Time        Source                Destination           Protocol Length Info
     67 2.725364    192.168.1.164         142.104.5.64          HTTP     344    GET /assets/images/bullet.gif HTTP/1.1 

Frame 67: 344 bytes on wire (2752 bits), 344 bytes captured (2752 bits)
Ethernet II, Src: Intel_a1:48:60 (00:0e:35:a1:48:60), Dst: 3com_20:98:c5 (00:10:5a:20:98:c5)
Internet Protocol Version 4, Src: 192.168.1.164 (192.168.1.164), Dst: 142.104.5.64 (142.104.5.64)
Transmission Control Protocol, Src Port: 1200 (1200), Dst Port: 80 (80), Seq: 1143, Ack: 32922, Len: 290
Hypertext Transfer Protocol

No.     Time        Source                Destination           Protocol Length Info
     68 2.730159    142.104.5.64          192.168.1.164         TCP      1514   [TCP segment of a reassembled PDU]

Frame 68: 1514 bytes on wire (12112 bits), 1514 bytes captured (12112 bits)
Ethernet II, Src: 3com_20:98:c5 (00:10:5a:20:98:c5), Dst: Intel_a1:48:60 (00:0e:35:a1:48:60)
Internet Protocol Version 4, Src: 142.104.5.64 (142.104.5.64), Dst: 192.168.1.164 (192.168.1.164)
Transmission Control Protocol, Src Port: 80 (80), Dst Port: 1201 (1201), Seq: 17521, Ack: 294, Len: 1460

No.     Time        Source                Destination           Protocol Length Info
     69 2.732155    142.104.5.64          192.168.1.164         HTTP     816    HTTP/1.1 200 OK  (JPEG JFIF image)

Frame 69: 816 bytes on wire (6528 bits), 816 bytes captured (6528 bits)
